"document","topic","probability","published_date","title_tokens","clear_title","content_tokens","clear_content"
1107,6,0.552845528455285,"02/04/2025","death, toll, ctg, busmicrobus, collision, rises, 10","death toll ctg busmicrobu collis rise 10","death, toll, headon, collision, bus, microbus, lohagara, upazila, chattogram, rose, 10, deceased, passengers, microbus, however, identities, deceased, known, immediately, confirming, information, shuvo, ranjan, chakma, officerincharge, dohazari, highway, police, station, said, seven, people, died, spot, bus, collided, head, microbus, chunati, jangalia, area, upazila, around, 730, three, injured, rescued, sent, chattogram, medical, college, hospital, succumbed, injuries, undergoing, treatment, incident, took, place, chattogramcox’s, bazar, highway, chunati, jangalia, area, upazila, around, 730, wednesday, fire, service, said, bus, collided, head, microbus, chattogramcox’s, bazar, highway, chunati, area, lohagara, upazila, morning, leaving, seven, people, including, driver, microbus, dead, several, others, injured, information, rescue, team, fire, service, rushed, spot, sent, injured, hospital","death toll headon collis bu microbu lohagara upazila chattogram rise 10 deceas passeng microbu howev ident deceas know immedi confirm inform shuvo ranjan chakma officerincharg dohazari highwai polic station sai seven peopl die spot bu collid head microbu chunati jangalia area upazila around 730 three injur rescu send chattogram medic colleg hospit succumb injuri undergo treatment incid take place chattogramcox’ bazar highwai chunati jangalia area upazila around 730 wednesdai fire servic sai bu collid head microbu chattogramcox’ bazar highwai chunati area lohagara upazila morn leav seven peopl includ driver microbu dead sever other injur inform rescu team fire servic rush spot send injur hospit"
834,6,0.515151515151515,"11/05/2025","lightning, strikes, kill, 8, brahmanbaria, kishoreganj","lightn strike kill 8 brahmanbaria kishoreganj","least, eight, people, killed, lightning, strikes, brahmanbaria, kishoreganj, sunday, five, people, including, child, killed, woman, injured, separate, lightning, strikes, brahmanbaria, district, incidents, occurred, various, areas, nasirnagar, akhaura, upazilas, district, deceased, shamsul, haq, 65, gokarna, bhanga, bridge, area, abdur, razzaq, 40, village, zakia, begum, 8, durgapur, village, bhalkut, md, selim, mia, 64, ruti, nurpur, area, dharakhar, union, md, zamir, khan, 22, bangaj, village, nasinagar, upazila, nirbahi, officer, shahina, nasrin, said, three, people, killed, one, injured, upazila, due, lightning, afternoon, among, deceased, shamsul, haq, died, fetching, cattle, abdur, razzaq, killed, harvesting, paddy, tekanagar, area, eightyearold, zakia, begum, killed, playing, yard, hamida, begum, 45, village, seriously, injured, people, killed, two, separate, incidents, lightning, strikes, bhairab, kuliarchar, upazilas, kishoreganj, district, sunday, nativeclick, ads, victims, faruk, mia, 65, faisal, mia, 28, sadekpur, union, bhairab, upazila, kabir, hossain, 25, hajarinagar, kuliarchar, upazila, doctor, bhairab, upazila, health, complex, umme, habiba, jui, confirmed, matter, one, person, also, injured, lightning, strike, added","less eight peopl kill lightn strike brahmanbaria kishoreganj sundai five peopl includ child kill woman injur separ lightn strike brahmanbaria district incid occur variou area nasirnagar akhaura upazila district deceas shamsul haq 65 gokarna bhanga bridg area abdur razzaq 40 villag zakia begum 8 durgapur villag bhalkut md selim mia 64 ruti nurpur area dharakhar union md zamir khan 22 bangaj villag nasinagar upazila nirbahi offic shahina nasrin sai three peopl kill on injur upazila due lightn afternoon among deceas shamsul haq die fetch cattl abdur razzaq kill harvest paddi tekanagar area eightyearold zakia begum kill plai yard hamida begum 45 villag serious injur peopl kill two separ incid lightn strike bhairab kuliarchar upazila kishoreganj district sundai nativeclick ad victim faruk mia 65 faisal mia 28 sadekpur union bhairab upazila kabir hossain 25 hajarinagar kuliarchar upazila doctor bhairab upazila health complex umm habiba jui confirm matter on person also injur lightn strike add"
301,6,0.507246376811594,"19/04/2025","body, missing, baby, found, floating, 14, hours","bodi miss babi find float 14 hour","body, sixmonthold, baby, went, missing, falling, drain, kapasgola, area, chawkbazar, police, station, chattogram, city, recovered, nearly, 14, hours, body, found, floating, distance, accident, spot, around, 11, saturday, earlier, incident, took, place, near, kapasgola, nawab, hotel, around, 830, prime, minister, friday, chattogram, fire, service, deputy, director, abdul, mannan, confirmed, information, fire, service, local, sources, said, rained, heavily, several, hours, friday, evening, batteryrun, rickshaw, fell, drain, passengers, lost, control, kapasgola, area, around, 830, prime, minister, woman, passenger, rickshaw, along, sixmonthold, baby, locals, immediately, rescued, rickshaw, driver, woman, passenger, however, baby, woman’s, lap, went, missing, water, upon, receiving, information, personnel, fire, service, navy, ansar, chattogram, city, corporation, conducted, rescue, operations, baby, however, found, although, rescue, operations, continued, till, 12, body, found, floating, around, 11, rescue, operations, resumed, morning","bodi sixmonthold babi go miss fall drain kapasgola area chawkbazar polic station chattogram citi recov nearli 14 hour bodi find float distanc accid spot around 11 saturdai earli incid take place near kapasgola nawab hotel around 830 prime minist fridai chattogram fire servic deputi director abdul mannan confirm inform fire servic local sourc sai rain heavili sever hour fridai even batteryrun rickshaw fall drain passeng lose control kapasgola area around 830 prime minist woman passeng rickshaw along sixmonthold babi local immedi rescu rickshaw driver woman passeng howev babi woman’ lap go miss water upon receiv inform personnel fire servic navi ansar chattogram citi corpor conduct rescu oper babi howev find although rescu oper continu till 12 bodi find float around 11 rescu oper resum morn"
456,6,0.495798319327731,"25/04/2025","mother, son, killed, satkhira, road, crash","mother son kill satkhira road crash","mother, son, killed, two, others, injured, fatal, road, accident, kumira, area, patkelghata, upazila, satkhira, friday, deceased, identified, rita, sadhu, wife, amit, sadhu, kapilmuni, village, paikgachha, upazila, khulna, district, threeyear, old, son, sourav, sadhu, accident, two, persons, father, amit, sadhu, fouryear, old, daughter, shova, sadhu, sustained, injuries, currently, undergoing, treatment, accident, occurred, kumira, kadamtala, intersection, satkhirakhulna, highway, around, 1230, prime, minister, according, locals, amit, sadhu, traveling, fatherinlaw, house, sagardari, area, keshabpur, upazila, wife, two, children, motorcycle, home, passing, kumira, kadamtala, intersection, satkhirabound, passenger, bus, coming, opposite, direction, hit, motorbike, behind, leaving, rita, son, sourav, dead, spot, police, inspector, patkelghata, police, station, sanjay, kumar, das, confirmed, said, bodies, deceased, recovered, sent, sadar, hospital, morgue","mother son kill two other injur fatal road accid kumira area patkelghata upazila satkhira fridai deceas identifi rita sadhu wife amit sadhu kapilmuni villag paikgachha upazila khulna district threeyear old son sourav sadhu accid two person father amit sadhu fouryear old daughter shova sadhu sustain injuri current undergo treatment accid occur kumira kadamtala intersect satkhirakhulna highwai around 1230 prime minist accord local amit sadhu travel fatherinlaw hous sagardari area keshabpur upazila wife two child motorcycl home pass kumira kadamtala intersect satkhirabound passeng bu come opposit direct hit motorbik behind leav rita son sourav dead spot polic inspector patkelghata polic station sanjai kumar da confirm sai bodi deceas recov send sadar hospit morgu"
197,7,0.463768115942029,"13/04/2025","set, celebrate, pahela, baishakh","set celebr pahela baishakh","preparations, completed, celebration, pahela, baishakh, first, day, bangla, new, year1432, faculty, fine, arts, dhaka, university, making, lastminute, preparations, welcome, first, day, baishakh, fishing, work, various, materials, including, masks, already, almost, complete, bengali, new, year, celebrated, first, time, since, july, revolution, occasion, chaitra, sangkranti, pahela, baishakh, governmenternment, taken, twoday, elaborate, programmes, first, time, year, celebrate, nobo, barsho, inclusive, manner, involving, people, different, ethnic, groups, first, time, governmenternment, taken, initiative, organize, inclusive, festival, national, level, celebrate, bangla, new, year, 1432, new, years, ethnic, groups, including, chakma, marma, tripura, garo, according, handout, issued, cultural, affairs, ministry, celebration, bangla, new, year, 1432, will, mandatorily, begin, performance, national, anthem, song, esho, boishakh, esho, esho, morning, pahela, baishakh, nativeclick, ads, faculty, fine, arts, dhaka, university, will, organize, grand, procession, titled, barshobaran, ananda, shubhajatra, 9am, tomorrow, cultural, programme, pahela, baishakh, year, procession, will, held, inclusive, universal, manner, ensuring, participation, bangla, community, also, chakma, marma, tripura, garo, manipuri, ethnic, groups, well, female, footballers","prepar complet celebr pahela baishakh first dai bangla new year1432 faculti fine art dhaka univers make lastminut prepar welcom first dai baishakh fish work variou materi includ mask alreadi almost complet bengali new year celebr first time sinc juli revolut occas chaitra sangkranti pahela baishakh governmentern take twodai elabor programm first time year celebr nobo barsho inclus manner involv peopl differ ethnic group first time governmentern take initi organ inclus festiv nation level celebr bangla new year 1432 new year ethnic group includ chakma marma tripura garo accord handout issu cultur affair ministri celebr bangla new year 1432 will mandatorili begin perform nation anthem song esho boishakh esho esho morn pahela baishakh nativeclick ad faculti fine art dhaka univers will organ grand process titl barshobaran ananda shubhajatra 9am tomorrow cultur programm pahela baishakh year process will hold inclus univers manner ensur particip bangla commun also chakma marma tripura garo manipuri ethnic group good femal footbal"
983,7,0.461538461538462,"26/03/2025","5, eid, jamaats, held, baitul, mukarram","5 eid jamaat hold baitul mukarram","five, eid, jamaats, will, held, baitul, mukarram, national, mosque, day, eidulfitr, according, press, release, islamic, foundation, first, eid, jamaateislami, will, held, 7am, second, will, take, place, 8am, third, one, 9am, fourth, one, 10am, last, eid, jamaateislami, will, held, 1045am, baitul, mukarram, national, mosque, pesh, imam, hafez, mufti, maulana, muhibbullahil, baki, will, lead, first, congregation, second, congregation, will, led, senior, pesh, imam, hafez, mufti, maulana, mizanur, rahman, islamic, foundation, muhaddis, dr, maulana, mufti, waliur, rahman, khan, will, lead, third, eid, jamaateislami, fourth, one, will, conducted, islamic, foundation, dr, mushtaq, ahmed, islamic, foundation, mufti, md, abdullah, will, lead, fifth, last, congregation, eidulfitr, national, mosque, imam, conduct, eid, jamaateislami, islamic, foundation, deputy, director, maulana, md, jakir, hossain, will, lead, congregation","five eid jamaat will hold baitul mukarram nation mosqu dai eidulfitr accord press releas islam foundat first eid jamaateislami will hold 7am 2 will take place 8am 3 on 9am 4 on 10am last eid jamaateislami will hold 1045am baitul mukarram nation mosqu pesh imam hafez mufti maulana muhibbullahil baki will lead first congreg 2 congreg will lead senior pesh imam hafez mufti maulana mizanur rahman islam foundat muhaddi dr maulana mufti waliur rahman khan will lead 3 eid jamaateislami 4 on will conduct islam foundat dr mushtaq ahm islam foundat mufti md abdullah will lead 5 last congreg eidulfitr nation mosqu imam conduct eid jamaateislami islam foundat deputi director maulana md jakir hossain will lead congreg"
198,7,0.457943925233645,"14/04/2025","nation, celebrating, pahela, baishakh","nation celebr pahela baishakh","nation, celebrating, pahela, baishakh, first, day, bengali, new, year, 1432, monday, widespread, festivities, engaging, communities, ethnic, backgrounds, occasion, bangla, new, year, various, programmes, organised, public, venues, capital, elsewhere, across, country, entities, ministry, cultural, affairs, various, cultural, social, organisations, educational, institutions, taken, preparations, celebrate, day, amid, heightened, security, measures, occasion, day, begins, chhayanaut’s, traditional, cultural, event, ramna, park, dhaka, university, will, bring, main, traditional, new, year, procession, campus, recently, renamed, barshabaran, ananda, shobhajatra, place, mangal, shobhajatra, celebrated, 1989, du, authorities, said, brought, back, original, name, make, celebrations, inclusive, original, title, procession, ananda, shobhajatra, chief, adviser, professor, muhammad, yunus, sunday, statement, greeted, country’s, people, occasion, pahela, baishakh, statement, said, pahela, baishakh, one, symbols, harmony, nativeclick, ads, hindus, muslims, buddhists, christians, various, communities, peoples, hills, plains, country, together, people, country, diverse, languages, cultures, traditions, said, professor, yunus, cultural, organisation, chhayanaut, organises, pahela, baishakh, celebration, programme, ramna, green, biggest, event, organised, every, year, since, 1967, celebrate, bengali, new, year, chhayanaut, programme, began, 615am, playing, ahir, bhairab, raga, twohour, programme, features, solo, group, songs, recitations, including, singing, tagore, song, amar, mukti, aloy, aloy, dhaka, university, association, bangladesh, shilpakala, academy, will, organise, barshabaran, ananda, shobhajatra, will, start, 900am, du, faculty, fine, arts, premises, procession, will, carry, traditional, motifs, created, usual, students, teachers, faculty, year’s, procession, designed, inclusive, ever, welcoming, participation, ethnic, minority, groups, including, chakma, marma, tripura, garo, manipuri, others, female, footballers, will, also, take, part, festivities, group, will, present, cultural, identity, music, traditional, instruments, numerous, cultural, organizations, including, shurer, dhara, rishij, shilpigoshthi, bulbul, lalitakala, academy, garo, cultural, groups, will, stage, performances, department, theatre, performance, studies, dhaka, university, renowned, groups, will, also, take, part, processions, cultural, events, will, held, across, every, district, upazila, union, involving, people, communities, local, administrations, will, organize, traditional, fairs, cultural, shows, essay, contests, various, competitions, engage, public, educational, institutions, will, independently, celebrate, day, festive, programs, bangla, academy, bangladesh, small, cottage, industries, corporation, will, hold, weeklong, baishakhi, fair, discussion, sessions, bangladesh, folk, art, crafts, foundation, will, also, organize, new, year, fair, capital, du, shahbagh, metro, stations, will, remain, closed, pahela, baishakh, 800am, 1200pm, ensure, security, celebrations, besides, public, participation, pahela, baishakh, celebrations, will, allowed, 500pm, thereafter, entry, will, open, students, staff, concerned, ministry, cultural, affairs, will, organise, concert, together, drone, show, manik, miah, avenue, dhaka, today, 300pm, occasion, bangladesh, shilpakala, academy, bangla, academy, bangladesh, folk, art, crafts, foundation, will, also, organise, separate, cultural, events, fairs, celebrate, bengali, new, year, security, strengthened, across, administrative, levels, ensure, safe, peaceful, celebrations, law, enforcement, agencies, will, maintain, public, order, facilitating, free, access, event, venues, fire, service, civil, defence, will, standby, emergencies","nation celebr pahela baishakh first dai bengali new year 1432 mondai widespread festiv engag commun ethnic background occas bangla new year variou programm organis public venu capit elsewher across countri entiti ministri cultur affair variou cultur social organis educ institut take prepar celebr dai amid heighten secur measur occas dai begin chhayanaut’ tradit cultur event ramna park dhaka univers will bring main tradit new year process campu recent renam barshabaran ananda shobhajatra place mangal shobhajatra celebr 1989 du author sai bring back origin name make celebr inclus origin titl process ananda shobhajatra chief advis professor muhammad yunu sundai statement greet country’ peopl occas pahela baishakh statement sai pahela baishakh on symbol harmoni nativeclick ad hindu muslim buddhist christian variou commun peopl hill plain countri togeth peopl countri divers languag cultur tradit sai professor yunu cultur organis chhayanaut organis pahela baishakh celebr programm ramna green big event organis everi year sinc 1967 celebr bengali new year chhayanaut programm begin 615am plai ahir bhairab raga twohour programm featur solo group song recit includ sing tagor song amar mukti aloi aloi dhaka univers associ bangladesh shilpakala academi will organis barshabaran ananda shobhajatra will start 900am du faculti fine art premis process will carri tradit motif creat usual student teacher faculti year’ process design inclus ever welcom particip ethnic minor group includ chakma marma tripura garo manipuri other femal footbal will also take part festiv group will present cultur ident music tradit instrument numer cultur organ includ shurer dhara rishij shilpigoshthi bulbul lalitakala academi garo cultur group will stage perform depart theatr perform studi dhaka univers renown group will also take part process cultur event will hold across everi district upazila union involv peopl commun local administr will organ tradit fair cultur show essai contest variou competit engag public educ institut will independ celebr dai festiv program bangla academi bangladesh small cottag industri corpor will hold weeklong baishakhi fair discuss session bangladesh folk art craft foundat will also organ new year fair capit du shahbagh metro station will remain close pahela baishakh 800am 1200pm ensur secur celebr besid public particip pahela baishakh celebr will allow 500pm thereaft entri will open student staff concern ministri cultur affair will organis concert togeth drone show manik miah avenu dhaka todai 300pm occas bangladesh shilpakala academi bangla academi bangladesh folk art craft foundat will also organis separ cultur event fair celebr bengali new year secur strengthen across administr level ensur safe peac celebr law enforc agenc will maintain public order facilit free access event venu fire servic civil defenc will standbi emerg"
593,7,0.442748091603053,"01/05/2025","venues, key, dates, announced, icc, women’s, t20, world, cup","venu kei date announc icc women’ t20 world cup","seven, venues, confirmed, host, icc, women’s, t20, world, cup, next, year, england, historic, lord’s, cricket, ground, confirmed, venue, final, icc, women’s, t20, world, cup, 2026, title, clash, set, 5, july, announcement, made, 1, may, launch, event, lord’s, also, revealed, edgbaston, hampshire, bowl, headingley, old, trafford, cricket, ground, oval, bristol, county, ground, will, host, matches, tournament, icc, women’s, t20, world, cup, 2026, will, begin, 12, june, span, 24, days, featuring, 33, matches, reaching, grand, finale, lord’s, full, tournament, schedule, will, unveiled, due, course, expanded, field, 12, teams, largest, ever, women’s, t20, world, cup, edition, promises, competitive, yet, best, world, vie, prestigious, title, eight, teams, hosts, england, australia, india, new, zealand, pakistan, south, africa, sri, lanka, west, indies, already, secured, spots, icc, women’s, t20, world, cup, 2026, four, additional, teams, will, join, qualifier, scheduled, next, year, 12, teams, will, split, two, groups, six, group, stage, followed, knockout, rounds, finals","seven venu confirm host icc women’ t20 world cup next year england histor lord’ cricket grind confirm venu final icc women’ t20 world cup 2026 titl clash set 5 juli announc make 1 mai launch event lord’ also reveal edgbaston hampshir bowl headinglei old trafford cricket grind oval bristol counti grind will host match tournament icc women’ t20 world cup 2026 will begin 12 june spin 24 dai featur 33 match reach grand final lord’ full tournament schedul will unveil due cours expand field 12 team larg ever women’ t20 world cup edit promis competit yet good world vie prestigi titl eight team host england australia india new zealand pakistan south africa sri lanka west indi alreadi secur spot icc women’ t20 world cup 2026 four addit team will join qualifi schedul next year 12 team will split two group six group stage follow knockout round final"
298,7,0.441441441441441,"18/04/2025","bangladesh, shows, great, performance, start, ahf, cup","bangladesh show great perform start ahf cup","defending, champions, bangladesh, national, men, hockey, beat, kyrgyzstan, 51, goals, pool, b, opening, match, held, jakarta, indonesia, friday, men, red, green, won, ahf, cup, title, last, four, editions, 2008, 2012, 2016, 2022, respectively, will, play, second, match, indonesia, sunday, bangladesh, will, play, remaining, two, group, matches, thailand, sri, lanka, april, 22, 23, respectively, barren, first, quarter, bangladesh, took, lead, 24th, minute, asharaful, islam, scored, first, goal, converting, penalty, corner, 24th, minute, lead, last, minutes, agymtay, restored, party, kazakhstan, also, penalty, corner, 30th, minute, match, bangladesh, went, ahead, naim, uddin, rakibul, hasan, scored, two, goals, 38th, 39th, minutes, respectively, shohanur, rahman, sobuj, widened, bangladesh, margin, third, quarter, scoring, fourth, goal, 44th, minute, ashraful, sealed, victory, scoring, second, fifth, goal, bangladesh, 59th, minute, match, sohanur, rahman, sobuj, bangladesh, named, player, match, impressive, performance, match","defend champion bangladesh nation man hockei beat kyrgyzstan 51 goal pool b open match hold jakarta indonesia fridai man red green win ahf cup titl last four edit 2008 2012 2016 2022 respect will plai 2 match indonesia sundai bangladesh will plai remain two group match thailand sri lanka april 22 23 respect barren first quarter bangladesh take lead 24th minut ashara islam score first goal convert penalti corner 24th minut lead last minut agymtai restor parti kazakhstan also penalti corner 30th minut match bangladesh go ahead naim uddin rakibul hasan score two goal 38th 39th minut respect shohanur rahman sobuj widen bangladesh margin 3 quarter score 4 goal 44th minut ashra seal victori score 2 5 goal bangladesh 59th minut match sohanur rahman sobuj bangladesh name player match impress perform match"
807,8,0.632530120481928,"10/05/2025","meet, demand, within, one, hour, face, march, jamuna, hasnat","meet demand within on hour face march jamuna hasnat","chief, organizer, national, citizen, party, southern, region, hasnat, abdullah, threatened, governmenternment, demand, ban, awami, league, met, within, one, hour, will, hold, march, jamuna, program, hasnat, abdullah, made, threat, gathering, shahbagh, intersection, capital, saturday, night, ncp, leader, said, ban, awami, league, given, one, hour, announcement, made, within, one, hour, will, besiege, jamuna, leaders, activists, different, political, parties, common, people, gathered, shahbagh, intersection, capital, demanding, ban, awami, league, people, started, gathering, around, 200pm, saturday, program, began, 300pm, students, people, also, blocked, shahbagh, intersection, capital, friday, demanding, complete, ban, awami, league, took, position, shahbagh, intersection, around, 445pm, friday, stopping, traffic, movement, chief, organizer, national, citizen, party, southern, region, hasnat, abdullah, called, program, nativeclick, ads, earlier, students, people, took, position, front, chief, adviser’s, residence, state, guesthouse, jamuna, press, home, demand, wake, situation, advisory, council, interim, governmenternment, holding, emergency, meeting","chief organ nation citizen parti southern region hasnat abdullah threaten governmentern demand ban awami leagu meet within on hour will hold march jamuna program hasnat abdullah make threat gather shahbagh intersect capit saturdai night ncp leader sai ban awami leagu give on hour announc make within on hour will besieg jamuna leader activist differ polit parti common peopl gather shahbagh intersect capit demand ban awami leagu peopl start gather around 200pm saturdai program begin 300pm student peopl also block shahbagh intersect capit fridai demand complet ban awami leagu take posit shahbagh intersect around 445pm fridai stop traffic movement chief organ nation citizen parti southern region hasnat abdullah call program nativeclick ad earli student peopl take posit front chief adviser’ resid state guesthous jamuna press home demand wake situat advisori council interim governmentern hold emerg meet"
