"document","topic","probability","published_date","title_tokens","clear_title","content_tokens","clear_content"
71,3,0.55363321799308,"08/04/2025","trump, threatens, new, 50, tariffs, china","trump threaten new 50 tariff china","donald, trump, threatened, china, extra, 50, tariff, goods, imported, united, states, withdraw, 34, countertariff, global, markets, continue, fall, reports, bbc, beijing, retaliated, sunday, following, last, week, decision, trump, slap, 34, tax, chinese, imports, part, liberation, day, set, minimum, 10, levy, nearly, america, trading, partners, social, media, post, monday, trump, gave, china, tuesday, scrap, countermeasure, face, 50, tax, response, chinese, embassy, united, states, accused, washington, economic, bullying, said, beijing, will, firmly, safeguard, legitimate, rights, interests, trump, acts, threat, united, states, companies, face, total, rate, 104, chinese, imports, comes, top, 20, tariffs, already, put, place, march, 34, announced, last, week, fears, deepen, trade, war, world, two, biggest, economies, global, rivals, post, truth, social, trump, also, warned, talks, china, concerning, requested, meetings, us, tariffs, will, terminated, also, monday, united, states, president, said, considering, pause, global, import, tariffs, allow, negotiations, countries, nativeclick, ads, looking, many, many, countries, coming, negotiate, deals, us, going, fair, deals, said, trump, said, china, introduced, countermeasure, despite, warning, country, retaliates, us, issuing, additional, tariffs, will, immediately, met, new, substantially, higher, tariffs, beijing, shot, back, saying, pressuring, threatening, china, right, way, engage, united, states, hegemonic, move, name, areciprocity, serves, selfish, interests, expense, countries, legitimate, interests, puts, america, first, international, rules, chinese, embassy, spokesman, liu, pengyu, said, statement, typical, move, unilateralism, protectionism, economic, bullying, speaking, white, house, united, states, president, said, permanent, tariffs, negotiations, 36tn, debt, reason, said, adding, united, states, talking, china, among, countries, make, fair, deal, good, deal, now, america, first, trump, said, tariffs, come, major, blow, china, manufacturers, united, states, key, market, exports, china, top, exports, united, states, include, electrical, products, machinery, computers, furniture, toys, vehicles, equipment, united, states, top, exports, china, oilseeds, grains, well, aircraft, machinery, pharmaceuticals, uncertainty, around, tariffs, led, turbulent, day, global, stock, markets, markets, worldwide, plunged, since, trump, announced, global, tariffs, value, united, states, stock, markets, dropped, sharply, opening, monday, europe, biggest, markets, including, london, ftse, 100, closed, 4, asian, share, indexes, nosedived, monday, hong, kong, hang, seng, index, falling, 13, biggest, oneday, fall, since, 1997, however, showed, slight, correction, tuesday, bourses, opening, higher, impact, ftse, 100, america, sp, 500, germany, dax, japan, nikkei, widerangingagencies","donald trump threaten china extra 50 tariff good import unit state withdraw 34 countertariff global market continu fall report bbc beij retali sundai follow last week decis trump slap 34 tax chines import part liber dai set minimum 10 levi nearli america trade partner social medium post mondai trump give china tuesdai scrap countermeasur face 50 tax respons chines embassi unit state accus washington econom bulli sai beij will firmli safeguard legitim right interest trump act threat unit state compani face total rate 104 chines import come top 20 tariff alreadi put place march 34 announc last week fear deepen trade war world two big economi global rival post truth social trump also warn talk china concern request meet u tariff will termin also mondai unit state presid sai consid paus global import tariff allow negoti countri nativeclick ad look mani mani countri come negoti deal u go fair deal sai trump sai china introduc countermeasur despit warn countri retali u issu addit tariff will immedi meet new substanti high tariff beij shoot back sai pressur threaten china right wai engag unit state hegemon move name areciproc serv selfish interest expens countri legitim interest put america first intern rule chines embassi spokesman liu pengyu sai statement typic move unilater protection econom bulli speak white hous unit state presid sai perman tariff negoti 36tn debt reason sai add unit state talk china among countri make fair deal good deal now america first trump sai tariff come major blow china manufactur unit state kei market export china top export unit state includ electr product machineri comput furnitur toi vehicl equip unit state top export china oilse grain good aircraft machineri pharmaceut uncertainti around tariff lead turbul dai global stock market market worldwid plung sinc trump announc global tariff valu unit state stock market drop sharpli open mondai europ big market includ london ftse 100 close 4 asian share index nosed mondai hong kong hang seng index fall 13 big onedai fall sinc 1997 howev show slight correct tuesdai bours open high impact ftse 100 america sp 500 germani dax japan nikkei widerangingag"
103,3,0.550522648083624,"09/04/2025","tariffs, china, set, rise, least, 104, trump","tariff china set rise less 104 trump","united, states, president, donald, trump, set, impose, astounding, 104, levies, across, chinese, imports, wednesday, white, house, press, secretary, karoline, leavitt, announced, tuesday, comes, top, chinese, tariffs, place, prior, trump’s, second, term, reports, cnn, china, already, set, see, tariffs, increase, 34, wednesday, part, trump’s, reciprocal, tariffs, package, president, tacked, another, 50, beijing, didn’t, back, promise, impose, 34, retaliatory, tariffs, united, states, goods, noon, tuesday, adding, additional, 84, duties, earlier, tuesday, china’s, commerce, ministry, said, firmly, opposes, additional, 50, tariffs, chinese, imports, calling, mistake, upon, mistake, ministry, vowed, escalate, retaliation, united, states, exports, united, states, stocks, soared, tuesday, morning, began, moving, lower, following, leavitt’s, comments, markets, ultimately, ended, day, markedly, lower, dow, fell, 320, points, 084, broader, sp, 500, fell, 157, techheavy, nasdaq, composite, slid, 215, countries, like, china, chosen, retaliate, try, double, mistreatment, american, workers, making, mistake, leavitt, told, reporters, tuesday, president, trump, spine, steel, will, break, chinese, want, make, deal, just, don’t, know, added, declined, share, terms, trump, consider, lower, tariffs, china, asian, markets, largely, tracked, wall, street’s, losses, japan’s, nikkei, 225, opening, 3, lower, wednesday, hong, kong’s, hang, seng, also, fell, 3, south, korea’s, kopsi, australia’s, benchmark, asx, 200, index, 1, along, increasing, china’s, overall, tariff, rate, president, trump, also, signed, executive, order, tuesday, night, tripling, tariffs, goods, worth, less, 800, country, stands, packages, 800, exempt, tariffs, socalled, de, minimus, exemption, nativeclick, ads, initially, goods, set, face, tariffs, 30, come, may, 2, trump’s, latest, executive, order, hiked, rates, 90, will, impact, americans, order, sites, like, shein, temu, aliexpress, likely, leading, higher, prices, goods, february, trump, initially, imposed, 10, tariff, chinese, goods, exceptions, tying, country’s, alleged, role, aiding, illegal, immigration, getting, fentanyl, united, states, last, month, doubled, rates, china, america’s, second, largest, source, imports, last, year, shipping, total, 439, billion, worth, goods, united, states, united, states, exported, 144, billion, worth, goods, china, mutual, tariffs, threaten, hurt, domestic, industries, poised, result, layoffs, trump’s, first, term, ended, united, states, charged, average, tariff, rate, 193, chinese, goods, according, peterson, institute, international, economic, analysis, biden, administration, kept, trump’s, tariffs, place, also, adding, additional, ones, bringing, average, rate, 208, come, wednesday, total, average, tariff, chinese, exports, united, states, will, soar, nearly, 125agencies","unit state presid donald trump set impos astound 104 levi across chines import wednesdai white hous press secretari karolin leavitt announc tuesdai come top chines tariff place prior trump’ 2 term report cnn china alreadi set see tariff increas 34 wednesdai part trump’ reciproc tariff packag presid tack anoth 50 beij didn’t back promis impos 34 retaliatori tariff unit state good noon tuesdai add addit 84 duti earli tuesdai china’ commerc ministri sai firmli oppos addit 50 tariff chines import call mistak upon mistak ministri vow escal retali unit state export unit state stock soar tuesdai morn begin move low follow leavitt’ comment market ultim end dai markedli low dow fall 320 point 084 broad sp 500 fall 157 techheavi nasdaq composit slide 215 countri like china choos retali try doubl mistreat american worker make mistak leavitt tell report tuesdai presid trump spine steel will break chines want make deal just don’t know add declin share term trump consid low tariff china asian market larg track wall street’ loss japan’ nikkei 225 open 3 low wednesdai hong kong’ hang seng also fall 3 south korea’ kopsi australia’ benchmark asx 200 index 1 along increas china’ overal tariff rate presid trump also sign execut order tuesdai night tripl tariff good worth littl 800 countri stand packag 800 exempt tariff socal de minimu exempt nativeclick ad initi good set face tariff 30 come mai 2 trump’ late execut order hike rate 90 will impact american order site like shein temu aliexpress like lead high price good februari trump initi impos 10 tariff chines good except tie country’ alleg role aid illeg immigr get fentanyl unit state last month doubl rate china america’ 2 larg sourc import last year ship total 439 billion worth good unit state unit state export 144 billion worth good china mutual tariff threaten hurt domest industri pois result layoff trump’ first term end unit state charg averag tariff rate 193 chines good accord peterson institut intern econom analysi biden administr keep trump’ tariff place also add addit on bring averag rate 208 come wednesdai total averag tariff chines export unit state will soar nearli 125agenc"
225,4,0.601731601731602,"15/04/2025","arrest, warrant, hasina, joy, 27, others","arrest warrant hasina joi 27 other","dhaka, court, issued, arrest, warrants, ousted, prime, minister, sheikh, hasina, son, sajeeb, wazed, joy, 27, others, two, separate, cases, filed, anticorruption, commission, scam, allocating, plots, rajdhani, unnayan, kartripakkha, purbachal, new, town, project, dhaka, metropolitan, senior, special, judge, md, zakir, hossain, galib, passed, orders, tuesday, accepting, formal, charges, filed, cases, court, also, set, april, 28, submitting, reports, execution, orders, arrest, accused, cases, aminul, islam, assistant, director, acc’s, prosecution, division, said, acc, deputy, director, md, salahuddin, filed, one, case, eight, including, sheikh, hasina, january, 14, abusing, power, allocating, 10katha, plot, purbachal, new, town, project, investigation, officer, acc, assistant, director, afnan, jannat, keya, march, 10, filed, charge, sheet, total, 12, apart, sheikh, hasina, 11, accused, case, ministry, housing, public, works, senior, assistant, secretary, purobi, goldar, administrative, officer, md, saiful, islam, sarkar, former, rajuk, chairman’s, personal, assistant, md, anisur, rahman, miah, former, rajuk, members, shafi, ul, haque, mohammad, khurshid, alam, mohammad, nasir, uddin, major, samsuddin, ahmed, chowdhury, deputy, director, nayeb, ali, sharif, secretaries, qazi, wasi, uddin, shahid, ullah, khandaker, former, state, minister, sharif, ahmed, meanwhile, acc, assistant, director, sm, rashedul, hasan, filed, case, 15, including, sheikh, hasina, son, sajeeb, wazed, joy, connection, filed, charge, sheet, 17, march, 10, apart, sheikh, hasina, joy, 15, accused, case, ministry, housing, public, works, senior, assistant, secretary, purobi, goldar, administrative, officer, md, saiful, islam, sarkar, secretaries, qazi, wasi, uddin, shahid, ullah, khandaker, former, rajuk, chairman’s, personal, assistant, md, anisur, rahman, miah, former, rajuk, members, mohammad, khurshid, alam, tanmay, das, mohammad, nasir, uddin, major, samsuddin, ahmed, chowdhury, md, nurul, islam, assistant, director, mazharul, islam, director, qamrul, islam, deputy, director, nayeb, ali, sharif, prime, minister’s, personal, secretary1, mohammad, salahuddin, former, state, minister, sharif, ahmed, io, charge, sheet, accused, joy, filing, application, designated, form, rajuk","dhaka court issu arrest warrant oust prime minist sheikh hasina son sajeeb waze joi 27 other two separ case file anticorrupt commiss scam alloc plot rajdhani unnayan kartripakkha purbach new town project dhaka metropolitan senior special judg md zakir hossain galib pass order tuesdai accept formal charg file case court also set april 28 submit report execut order arrest accus case aminul islam assist director acc’ prosecut divis sai acc deputi director md salahuddin file on case eight includ sheikh hasina januari 14 abus power alloc 10katha plot purbach new town project investig offic acc assist director afnan jannat keya march 10 file charg sheet total 12 apart sheikh hasina 11 accus case ministri hous public work senior assist secretari purobi goldar administr offic md saiful islam sarkar former rajuk chairman’ person assist md anisur rahman miah former rajuk member shafi ul haqu mohammad khurshid alam mohammad nasir uddin major samsuddin ahm chowdhuri deputi director nayeb ali sharif secretari qazi wasi uddin shahid ullah khandak former state minist sharif ahm meanwhil acc assist director sm rashedul hasan file case 15 includ sheikh hasina son sajeeb waze joi connect file charg sheet 17 march 10 apart sheikh hasina joi 15 accus case ministri hous public work senior assist secretari purobi goldar administr offic md saiful islam sarkar secretari qazi wasi uddin shahid ullah khandak former rajuk chairman’ person assist md anisur rahman miah former rajuk member mohammad khurshid alam tanmai da mohammad nasir uddin major samsuddin ahm chowdhuri md nurul islam assist director mazharul islam director qamrul islam deputi director nayeb ali sharif prime minister’ person secretary1 mohammad salahuddin former state minist sharif ahm io charg sheet accus joi file applic design form rajuk"
126,4,0.578947368421053,"10/04/2025","arrest, warrant, hasina, putul, 16, others, graft, case","arrest warrant hasina putul 16 other graft case","dhaka, court, issued, arrest, warrants, 18, people, including, former, prime, minister, sheikh, hasina, daughter, saima, wazed, putul, case, filed, irregularities, allocation, plots, purbachal, project, dhaka, metropolitan, senior, special, judge, court, judge, zakir, hossain, galib, passed, order, thursday, court, also, set, may, 4, submitting, probe, report, case, acc, public, prosecutor, mir, ahammed, salam, told, bss, anticorruption, commission, filed, case, january, 12, 2025, 16, people, including, ousted, prime, minister, sheikh, hasina, saima, wazed, putul, submitted, chargesheet, march, 10, adding, names, two, accused, bringing, total, number, accused, 18, accused, case, ministry, housing, public, works, administrative, officer, md, saiful, islam, sarkar, senior, assistant, secretary, purobi, goldar, additional, secretary, qazi, wasi, uddin, secretary, md, shahid, ullah, khandaker, former, rajuk, chairman, personal, assistant, md, anisur, rahman, miah, former, rajuk, member, mohammad, khurshid, alam, kabir, al, asad, tanmay, das, mohammad, nasir, uddin, major, samsuddin, ahmed, chowdhury, md, nurul, islam, sheikh, shahinul, islam, md, hafizur, rahman, habibur, rahman, prime, minister, personal, secretary1, mohammad, salahuddin, former, state, minister, sharif, ahmed, earlier, january, 12, acc, assistant, director, afnan, jannat, keya, filed, case, plaintiff, aminul, islam, assistant, director, prosecution, division, acc, court, confirmed, matter","dhaka court issu arrest warrant 18 peopl includ former prime minist sheikh hasina daughter saima waze putul case file irregular alloc plot purbach project dhaka metropolitan senior special judg court judg zakir hossain galib pass order thursdai court also set mai 4 submit probe report case acc public prosecutor mir aham salam tell bss anticorrupt commiss file case januari 12 2025 16 peopl includ oust prime minist sheikh hasina saima waze putul submit chargesheet march 10 add name two accus bring total numb accus 18 accus case ministri hous public work administr offic md saiful islam sarkar senior assist secretari purobi goldar addit secretari qazi wasi uddin secretari md shahid ullah khandak former rajuk chairman person assist md anisur rahman miah former rajuk member mohammad khurshid alam kabir al asad tanmai da mohammad nasir uddin major samsuddin ahm chowdhuri md nurul islam sheikh shahinul islam md hafizur rahman habibur rahman prime minist person secretary1 mohammad salahuddin former state minist sharif ahm earli januari 12 acc assist director afnan jannat keya file case plaintiff aminul islam assist director prosecut divis acc court confirm matter"
185,4,0.570731707317073,"13/04/2025","plot, scam, arrest, warrant, hasina, rehana, tulip, bobby","plot scam arrest warrant hasina rehana tulip bobbi","dhaka, court, issued, arrest, warrants, 53, individuals, including, former, prime, minister, sheikh, hasina, sister, sheikh, rehana, rehana’s, daughter, tulip, rizwana, siddiq, son, radwan, mujib, siddiq, bobby, another, daughter, azmira, siddiq, three, separate, cases, filed, allegations, corruption, rajuk’s, plot, allotment, judge, md, zakir, hossain, dhaka, metropolitan, senior, special, judge’s, court, passed, order, sunday, taking, cognizance, charges, accused, remained, absconding, aminul, islam, assistant, director, acc’s, prosecution, division, said, court, set, april, 27, submitting, probe, reports, cases, anticorruption, commission, deputy, director, salahuddin, filed, case, sheikh, hasina, sheikh, rehana, radwan, mujib, 12, others, taking, 10katha, plot, rajdhani, unnayan, kartripakkha, purbachal, misuse, power, forgery, investigation, officer, afnan, jannat, keya, filed, charge, sheet, case, march, 10, adding, names, two, accused, acc, assistant, director, afnan, jannat, keya, january, 13, filed, another, case, azmina, siddiq, taking, 10katha, plot, rajuk, project, misuse, power, forgery, total, 16, people, including, sheikh, hasina, tulip, implicated, case, charge, sheet, case, march, 10, adding, names, two, accused, assistant, director, sm, rashedul, hasan, acc, january, 13, filed, case, sheikh, rehana’s, son, radwan, mujib, siddiq, 15, others, allegation, mother, sisters, acc, official, march, 10, filed, charge, sheet, 18, antigraft, body, officials, charge, sheets, alleged, sheikh, rehana, daughter, azmina, son, radwan, like, saima, wazed, putul, malicious, intent, illegally, influenced, ousted, prime, minister, sheikh, hasina, filed, application, rather, rajuk, violating, laws, rules, policies, legal, procedures, regarding, allocation, plots, purbachal, new, city, housing, project, nativeclick, ads, done, even, though, family, members, owned, house, flat, housing, facility, area, jurisdiction, rajuk, dhaka, city, earlier, thursday, court, issued, arrest, warrants, former, pm, sheikh, hasina, daughter, saima, wazed, putul, 16, others, separate, case","dhaka court issu arrest warrant 53 individu includ former prime minist sheikh hasina sister sheikh rehana rehana’ daughter tulip rizwana siddiq son radwan mujib siddiq bobbi anoth daughter azmira siddiq three separ case file alleg corrupt rajuk’ plot allot judg md zakir hossain dhaka metropolitan senior special judge’ court pass order sundai take cogniz charg accus remain abscond aminul islam assist director acc’ prosecut divis sai court set april 27 submit probe report case anticorrupt commiss deputi director salahuddin file case sheikh hasina sheikh rehana radwan mujib 12 other take 10katha plot rajdhani unnayan kartripakkha purbach misus power forgeri investig offic afnan jannat keya file charg sheet case march 10 add name two accus acc assist director afnan jannat keya januari 13 file anoth case azmina siddiq take 10katha plot rajuk project misus power forgeri total 16 peopl includ sheikh hasina tulip implic case charg sheet case march 10 add name two accus assist director sm rashedul hasan acc januari 13 file case sheikh rehana’ son radwan mujib siddiq 15 other alleg mother sister acc offici march 10 file charg sheet 18 antigraft bodi offici charg sheet alleg sheikh rehana daughter azmina son radwan like saima waze putul malici intent illeg influenc oust prime minist sheikh hasina file applic rather rajuk violat law rule polici legal procedur regard alloc plot purbach new citi hous project nativeclick ad do even though famili member own hous flat hous facil area jurisdict rajuk dhaka citi earli thursdai court issu arrest warrant former pm sheikh hasina daughter saima waze putul 16 other separ case"
269,4,0.523809523809524,"17/04/2025","police, official, mamun, murder, arav, khan, 7, others, get, life, term","polic offici mamun murder arav khan 7 other get life term","dhaka, court, sentenced, eight, people, including, dubai’s, prominent, gold, trader, arav, khan, life, term, imprisonment, murder, case, inspector, mamun, imran, khan, special, branch, police, dhaka, metropolitan, sessions, judge, md, zakir, hossain, ghalib, handed, verdict, thursday, earlier, hearing, arguments, prosecution, defence, february, 18, court, set, verdict, date, march, 5, however, verdict, ready, day, date, verdict, postponed, march, 18, since, verdict, ready, day, court, set, april, 9, date, verdict, finally, court, fixed, today, pronouncing, verdict, trial, case, 26, 38, witnesses, testified, accused, case, dubaibased, gold, trader, rabiul, islam, alias, arav, khan, wife, suraiya, akhter, keya, rahmat, ullah, swapan, sarkar, didar, pathan, mizan, sheikh, atiq, hasan, sarwar, hossain, two, minor, girls, among, accused, rabiul, wife, absconding, rest, jail, two, minor, girls, bail, trial, going, juvenile, court, according, case, details, body, police, inspector, mamun, imran, khan, recovered, jungles, gazipur, july, 9, 2018, mamun’s, brother, jahangir, alam, khan, filed, murder, case, capital’s, banani, police, station, completing, investigation, case, investigating, officer, submitted, charge, sheet, case, court, april, 8, 2019, november, 25, 2021, court, framed, charges, accused","dhaka court sentenc eight peopl includ dubai’ promin gold trader arav khan life term imprison murder case inspector mamun imran khan special branch polic dhaka metropolitan session judg md zakir hossain ghalib hand verdict thursdai earli hear argument prosecut defenc februari 18 court set verdict date march 5 howev verdict readi dai date verdict postpon march 18 sinc verdict readi dai court set april 9 date verdict final court fix todai pronounc verdict trial case 26 38 wit testifi accus case dubaibas gold trader rabiul islam alia arav khan wife suraiya akhter keya rahmat ullah swapan sarkar didar pathan mizan sheikh atiq hasan sarwar hossain two minor girl among accus rabiul wife abscond rest jail two minor girl bail trial go juvenil court accord case detail bodi polic inspector mamun imran khan recov jungl gazipur juli 9 2018 mamun’ brother jahangir alam khan file murder case capital’ banani polic station complet investig case investig offic submit charg sheet case court april 8 2019 novemb 25 2021 court frame charg accus"
501,4,0.513274336283186,"27/04/2025","arrest, warrant, issued, interpol, putul","arrest warrant issu interpol putul","dhaka, court, issued, arrest, warrant, interpol, saima, wazed, putul, daughter, ex, prime, minister, sheikh, hasina, case, lodged, alleged, corruption, 10kathaplot, allocation, purbachal, new, town, judge, md, zakir, hossain, dhaka, metropolitan, senior, special, judge, court, passed, order, sunday, following, application, placed, anticorruption, commission, earlier, court, issued, arrest, warrants, 18, individuals, including, sheikh, hasina, saima, connection, case, fraud, purbachal, plot, allocation, april, 10, putul, staying, outside, country, investigating, officer, today, pleaded, arrest, warrant, interpol, hearing, court, granted, application, january, 12, 2025, acc, assistant, director, afnan, jannat, keya, filed, case, sheikh, hasina, putul, 16, others, connection, 10katha, plot, fraud, purbachal, dhaka","dhaka court issu arrest warrant interpol saima waze putul daughter ex prime minist sheikh hasina case lodg alleg corrupt 10kathaplot alloc purbach new town judg md zakir hossain dhaka metropolitan senior special judg court pass order sundai follow applic place anticorrupt commiss earli court issu arrest warrant 18 individu includ sheikh hasina saima connect case fraud purbach plot alloc april 10 putul stai outsid countri investig offic todai plead arrest warrant interpol hear court grant applic januari 12 2025 acc assist director afnan jannat keya file case sheikh hasina putul 16 other connect 10katha plot fraud purbach dhaka"
