"document","topic","probability","published_date","title_tokens","clear_title","content_tokens","clear_content"
365,1,0.621145374449339,"22/04/2025","chief, adviser, arrives, doha","chief advis arriv doha","chief, adviser, professor, muhammad, yunus, arrived, doha, capital, qatar, attend, earthna, summit, 2025, engagements, bangladesh, ambassador, qatar, md, nazrul, islam, received, prof, yunus, upon, arrival, hamad, international, airport, around, 2140, prime, minister, monday, biman, bangladesh, airlines, flight, chief, adviser’s, press, secretary, shafiqul, alam, confirmed, information, earlier, chief, adviser, departed, hazrat, shahjalal, international, airport, fourday, visit, 700pm, qatar, tour, chief, adviser’s, press, secretary, shafiqul, alam, said, prof, yunus, will, pass, busy, days, april, 22, april, 23, tour, qatar, chief, adviser, will, speak, earthna, summit, 2025he, will, series, engagements, visit, told, press, briefing, foreign, service, academy, yesterday, chief, adviser, paying, fourday, official, visit, invitation, qatar’s, amir, sheikh, tamim, bin, hamad, althani, visit, prof, yunus, likely, meetings, amir, qatar, deputy, prime, minister, sheikh, mohammed, apart, engagements, nativeclick, ads, alam, said, chief, adviser, will, meetings, qatar, charity, qatar, foundation, will, give, interview, qatarbased, al, jazeera, channel, bangladesh, longterm, agreement, qatar, lng, imports, will, discussion, greater, energy, sector, cooperation, said, said, will, investment, summit, april, 23, prof, yunus, will, also, speak, conference, rohingya, issue, global, stakeholders, will, join, foreign, adviser, md, touhid, hossain, national, security, adviser, dr, khalilur, rahman, energy, adviser, muhammad, fouzul, kabir, khan, executive, chairman, bangladesh, investment, development, authority, chowdhury, ashik, mahmud, bin, harun, principal, coordinator, sdg, affairs, lamiya, morshed, among, others, accompanying, chief, adviser, visit, prof, yunus, expected, return, home, early, hours, april, 25","chief advis professor muhammad yunu arriv doha capit qatar attend earthna summit 2025 engag bangladesh ambassador qatar md nazrul islam receiv prof yunu upon arriv hamad intern airport around 2140 prime minist mondai biman bangladesh airlin flight chief adviser’ press secretari shafiqul alam confirm inform earli chief advis depart hazrat shahjal intern airport fourdai visit 700pm qatar tour chief adviser’ press secretari shafiqul alam sai prof yunu will pass busi dai april 22 april 23 tour qatar chief advis will speak earthna summit 2025he will seri engag visit tell press brief foreign servic academi yesterdai chief advis pai fourdai offici visit invit qatar’ amir sheikh tamim bin hamad althani visit prof yunu like meet amir qatar deputi prime minist sheikh moham apart engag nativeclick ad alam sai chief advis will meet qatar chariti qatar foundat will give interview qatarbas al jazeera channel bangladesh longterm agreement qatar lng import will discuss great energi sector cooper sai sai will invest summit april 23 prof yunu will also speak confer rohingya issu global stakehold will join foreign advis md touhid hossain nation secur advis dr khalilur rahman energi advis muhammad fouzul kabir khan execut chairman bangladesh invest develop author chowdhuri ashik mahmud bin harun princip coordin sdg affair lamiya morsh among other accompani chief advis visit prof yunu expect return home earli hour april 25"
1127,1,0.59375,"03/04/2025","chief, adviser, arrives, bangkok","chief advis arriv bangkok","chief, adviser, professor, muhammad, yunus, arrived, bangkok, capital, thailand, join, sixth, bay, bengal, initiative, multisectoral, technical, economic, cooperation, summit, ca’s, deputy, press, secretary, abul, kalam, azad, majumder, confirmed, media, flight, biman, bangladesh, airlines, carrying, chief, adviser, entourage, members, landed, suvarnabhumi, airport, bangkok, 12, prime, minister, local, time, thursday, said, arrival, thai, minister, attendance, jiraporn, shinduprai, received, bangladesh, chief, adviser, airport, earlier, flight, biman, bangladesh, airlines, carrying, chief, adviser, entourages, departed, hazrat, shahjalal, international, airport, 855, bimstec, summit, 2025, will, focus, seven, key, pillars, regional, cooperation, trade, investment, development, environment, climate, change, security, agriculture, food, security, peopletopeople, contact, science, technology, innovation, connectivity, visit, bangkok, prof, yunus, will, speak, bimstec, summit, will, also, hold, bilateral, talks, leaders, bimstec, member, states, nativeclick, ads, prof, yunus, will, hold, bilateral, meeting, indian, prime, minister, narendra, modi, sidelines, summit, friday, well, will, also, present, two, mous, signing, ceremonies, summit, april, 4, bimstec, chairmanship, will, officially, handed, bangladesh, chief, adviser, bimstec, summit, held, bangkok, thailand, april, 24, prof, yunus, expected, return, home, friday, night","chief advis professor muhammad yunu arriv bangkok capit thailand join 6 bai bengal initi multisector technic econom cooper summit ca’ deputi press secretari abul kalam azad majumd confirm medium flight biman bangladesh airlin carri chief advis entourag member land suvarnabhumi airport bangkok 12 prime minist local time thursdai sai arriv thai minist attend jiraporn shinduprai receiv bangladesh chief advis airport earli flight biman bangladesh airlin carri chief advis entourag depart hazrat shahjal intern airport 855 bimstec summit 2025 will focu seven kei pillar region cooper trade invest develop environ climat chang secur agricultur food secur peopletopeopl contact scienc technologi innov connect visit bangkok prof yunu will speak bimstec summit will also hold bilater talk leader bimstec member state nativeclick ad prof yunu will hold bilater meet indian prime minist narendra modi sidelin summit fridai good will also present two mou sign ceremoni summit april 4 bimstec chairmanship will offici hand bangladesh chief advis bimstec summit hold bangkok thailand april 24 prof yunu expect return home fridai night"
5,1,0.585227272727273,"05/04/2025","chief, adviser, returns, home","chief advis return home","chief, adviser, professor, muhammad, yunus, returned, home, yesterday, night, wrapping, twoday, thailand, tour, join, sixth, bay, bengal, initiative, multisectoral, technical, economic, cooperation, summit, flight, biman, bangladesh, airlines, carrying, chief, adviser, entourage, landed, hazrat, shahjalal, international, airport, 1005pm, chief, adviser’s, deputy, press, secretary, abul, kalam, azad, majumder, brief, visit, bangkok, prof, yunus, spoke, bimstec, young, gen, forum, sidelines, bimstec, summit, thursday, addressed, bimstec, summit, yesterday, urging, bimstec, member, states, work, together, mutual, interests, shared, benefits, chief, adviser, received, bimstec, chairmanship, thailand, prime, minister, paetongtarn, shinawatra, next, two, years, earlier, day, chief, adviser, indian, prime, minister, narendra, modi, joined, bilateral, meeting, sidelines, bimstec, summit, besides, prof, yunus, held, bilateral, meetings, thailand, prime, minister, paetongtarn, shinawatra, bhutanese, prime, minister, dasho, tshering, tobgay, sri, lankan, prime, minister, harini, amarasuriya, bimstec, secretary, general, indra, mani, pandey, sidelines, summit, thai, minister, social, development, human, security, varawut, silpaarcha, thailand’s, minister, attached, prime, minister’s, office, jiraporn, sindhuprai, called, prof, yunus, yesterday, nativeclick, ads, prof, yunus, reached, thai, capital, thursday, join, sixth, bimstec, summit","chief advis professor muhammad yunu return home yesterdai night wrap twodai thailand tour join 6 bai bengal initi multisector technic econom cooper summit flight biman bangladesh airlin carri chief advis entourag land hazrat shahjal intern airport 1005pm chief adviser’ deputi press secretari abul kalam azad majumd brief visit bangkok prof yunu speak bimstec young gen forum sidelin bimstec summit thursdai address bimstec summit yesterdai urg bimstec member state work togeth mutual interest share benefit chief advis receiv bimstec chairmanship thailand prime minist paetongtarn shinawatra next two year earli dai chief advis indian prime minist narendra modi join bilater meet sidelin bimstec summit besid prof yunu hold bilater meet thailand prime minist paetongtarn shinawatra bhutanes prime minist dasho tshere tobgai sri lankan prime minist harini amarasuriya bimstec secretari gener indra mani pandei sidelin summit thai minist social develop human secur varawut silpaarcha thailand’ minist attach prime minister’ offic jiraporn sindhuprai call prof yunu yesterdai nativeclick ad prof yunu reach thai capit thursdai join 6 bimstec summit"
1141,1,0.574193548387097,"04/04/2025","chief, adviser, hold, bilateral, talks, modi, today","chief advis hold bilater talk modi todai","chief, adviser, professor, muhammad, yunus, will, hold, bilateral, talks, indian, prime, minister, narendra, modi, today, bangkok, sidelines, bay, bengal, initiative, multisectoral, technical, economic, cooperation, summit, bilateral, talks, will, held, 1210, prime, minister, 1230, prime, minister, ca’s, press, secretary, shafiqul, alam, confirmed, information, prof, yunus, also, scheduled, hold, number, meetings, bimstec, leaders, sidelines, summit, today, including, meetings, bhutanese, prime, minister, dasho, tshering, tobgay, thai, prime, minister, paetongtarn, shinawatra, myanmar, prime, minister, min, aung, hlaing, besides, will, deliver, speech, bimstec, summit, today, bimstec, chairmanship, will, officially, handed, bangladesh, chief, adviser, bimstec, secretary, general, indra, mani, pandey, will, also, meet, chief, adviser, thailand’s, minister, social, development, human, security, varawut, silpaarcha, thailand’s, minister, attached, prime, minister’s, office, jiraporn, sindhuprai, called, yunus, today, prof, yunus, arrived, thai, capital, thursday, join, sixth, bay, bengal, initiative, multisectoral, technical, economic, cooperation, summit, nativeclick, ads","chief advis professor muhammad yunu will hold bilater talk indian prime minist narendra modi todai bangkok sidelin bai bengal initi multisector technic econom cooper summit bilater talk will hold 1210 prime minist 1230 prime minist ca’ press secretari shafiqul alam confirm inform prof yunu also schedul hold numb meet bimstec leader sidelin summit todai includ meet bhutanes prime minist dasho tshere tobgai thai prime minist paetongtarn shinawatra myanmar prime minist min aung hla besid will deliv speech bimstec summit todai bimstec chairmanship will offici hand bangladesh chief advis bimstec secretari gener indra mani pandei will also meet chief advis thailand’ minist social develop human secur varawut silpaarcha thailand’ minist attach prime minister’ offic jiraporn sindhuprai call yunu todai prof yunu arriv thai capit thursdai join 6 bai bengal initi multisector technic econom cooper summit nativeclick ad"
1121,1,0.568181818181818,"03/04/2025","chief, adviser, leaves, thailand, today","chief advis leav thailand todai","chief, adviser, professor, muhammad, yunus, going, leave, today, bangkok, join, sixth, bay, bengal, initiative, multisectoral, technical, economic, cooperation, summit, flight, biman, bangladesh, airlines, carrying, chief, adviser, entourage, will, depart, hazrat, shahjalal, international, airport, today, 9am, confirmed, press, briefing, held, foreign, service, academy, wednesday, afternoon, bimstec, summit, held, bangkok, thailand, april, 24, press, briefing, chief, adviser’s, high, representative, rohingya, priority, issues, dr, khalilur, rahman, said, bimstec, summit, 2025, will, focus, seven, key, pillars, regional, cooperation, trade, investment, development, environment, climate, change, security, agriculture, food, security, peopletopeople, contact, science, technology, innovation, connectivity, said, chief, adviser, will, hold, bilateral, talks, leaders, bimstec, member, states, high, representative, said, prof, yunus, will, also, present, two, mou, signing, ceremonies, summit, april, 4, bimstec, chairmanship, will, officially, handed, bangladesh, chief, adviser, prof, yunus, added, nativeclick, ads, chief, adviser’s, press, secretary, shafiqul, alam, deputy, press, secretary, abdul, kalam, azad, majumder, also, present, press, briefing","chief advis professor muhammad yunu go leav todai bangkok join 6 bai bengal initi multisector technic econom cooper summit flight biman bangladesh airlin carri chief advis entourag will depart hazrat shahjal intern airport todai 9am confirm press brief hold foreign servic academi wednesdai afternoon bimstec summit hold bangkok thailand april 24 press brief chief adviser’ high repres rohingya prioriti issu dr khalilur rahman sai bimstec summit 2025 will focu seven kei pillar region cooper trade invest develop environ climat chang secur agricultur food secur peopletopeopl contact scienc technologi innov connect sai chief advis will hold bilater talk leader bimstec member state high repres sai prof yunu will also present two mou sign ceremoni summit april 4 bimstec chairmanship will offici hand bangladesh chief advis prof yunu add nativeclick ad chief adviser’ press secretari shafiqul alam deputi press secretari abdul kalam azad majumd also present press brief"
359,2,0.381526104417671,"21/04/2025","govt, restricts, new, industries, within, 10km, sundarbans","govt restrict new industri within 10km sundarban","governmenternment, decided, ban, establishment, new, industrial, ventures, projects, within, 10kilometre, ecologically, critical, area, around, sundarbans, ministry, environment, forest, climate, change, will, soon, issue, official, gazette, notification, regard, decision, taken, 16th, meeting, executive, committee, national, environment, climate, change, committee, held, ministry, conference, room, bangladesh, secretariat, monday, environment, forest, climate, change, adviser, syeda, rizwana, hasan, chair, meeting, previous, decisions, taken, section, 344, 2017, national, environment, committee, 2021, executive, committee, revised, strengthen, environmental, protection, sundarbans, independent, team, experts, will, assess, environmental, impact, existing, industries, within, 10, km, eca, decisions, regarding, establishments, will, taken, line, assessment, subject, court, directives, committee, also, decided, amend, climate, change, trust, rules, allowing, joint, project, proposals, governmenternment, agencies, private, organizations, ngos, check, noise, pollution, opinions, ministries, will, gathered, develop, future, action, plan, along, making, proposals, increase, enforcement, budget, ministry, environment, additionally, proposals, will, submitted, introduce, increase, risk, allowances, forest, department, employees, ministry, press, release, said, nativeclick, ads, also, decided, ensure, least, 30, block, usage, public, private, building, construction, 2025, coordination, meeting, secretary, level, will, held, may, matter, meeting, attended, faruk, e, azam, advisor, ministry, disaster, management, relief, ministry, liberation, war, affairs, lt, gen, md, jahangir, alam, chowdhury, adviser, ministry, agriculture, ministry, home, affairs, senior, officials, including, md, ehsanul, haque, senior, secretary, road, transport, highways, division, dr, farhina, ahmed, secretary, ministry, environment, forest, climate, change, farzana, mamataj, secretary, ministry, power, energy, mineral, resources, mahbubur, rahman, secretary, ministry, commerce, md, rezaul, maksud, jahedi, secretary, local, government, division, md, nazrul, islam, secretary, ministry, housing, public, works, among, others, also, present, committee, members, decisions, previous, meeting, agenda, current, meeting, presented, via, powerpoint, dr, fahmida, khanom, additional, secretary, ministry, member, secretary, committee","governmentern decid ban establish new industri ventur project within 10kilometr ecolog critic area around sundarban ministri environ forest climat chang will soon issu offici gazett notif regard decis take 16th meet execut committe nation environ climat chang committe hold ministri confer room bangladesh secretariat mondai environ forest climat chang advis syeda rizwana hasan chair meet previou decis take section 344 2017 nation environ committe 2021 execut committe revis strengthen environment protect sundarban independ team expert will assess environment impact exist industri within 10 km eca decis regard establish will take line assess subject court direct committe also decid amend climat chang trust rule allow joint project propos governmentern agenc privat organ ngo check nois pollut opinion ministri will gather develop futur action plan along make propos increas enforc budget ministri environ addition propos will submit introduc increas risk allow forest depart employe ministri press releas sai nativeclick ad also decid ensur less 30 block usag public privat build construct 2025 coordin meet secretari level will hold mai matter meet attend faruk e azam advisor ministri disast manag relief ministri liber war affair lt gen md jahangir alam chowdhuri advis ministri agricultur ministri home affair senior offici includ md ehsanul haqu senior secretari road transport highwai divis dr farhina ahm secretari ministri environ forest climat chang farzana mamataj secretari ministri power energi miner resourc mahbubur rahman secretari ministri commerc md rezaul maksud jahedi secretari local govern divis md nazrul islam secretari ministri hous public work among other also present committe member decis previou meet agendum current meet present via powerpoint dr fahmida khanom addit secretari ministri member secretari committe"
139,2,0.375,"10/04/2025","26928, students, absent, ssc, exams, 22, expelled","26928 student absent ssc exam 22 expel","secondary, school, certificate, equivalent, exams, began, across, country, thursday, amid, tight, security, measures, total, 26928, examinees, absent, first, day, ssc, equivalent, exams, 22, others, expelled, charge, adopting, unfair, means, information, reveled, press, release, signed, board, intermediate, secondary, education, chairman, intereducation, board, examination, controllers, committee, president, professor, dr, khandaker, ehasanul, kabir, bangla, first, paper, exam, held, today, peaceful, atmosphere, across, country, year, 1727778, ssc, candidates, across, country, 26928, candidates, absent, first, day, exam, dhaka, board, total, 339458, candidates, took, part, ssc, exam, first, day, 342954, candidates, total, 3496, candidates, absent, two, examinees, expelled, board, total, 123271, candidates, took, part, ssc, exam, chattogram, education, board, 124444, examinees, total, 1173, candidates, absent, rajshahi, education, board, 161057, examinees, took, part, exam, 162679, candidates, total, 1622, candidates, absent, nativeclick, ads, barishal, education, board, 77145, examinees, took, part, exam, 78178, candidates, two, examinees, expelled, board, sylhet, education, board, 82114, examinees, took, part, first, day, exam, 82992, total, 878, students, absent, one, student, expelled, copying, total, 166265, examinees, took, part, ssc, exam, dinajpur, education, board, 167606, candidates, total, 1341, candidates, absent, exam, board, cumilla, education, board, total, 147056, examinees, appeared, exam, 149588, candidates, total, 2553, students, absent, one, examinee, expelled, mymensingh, education, board, total, 91968, examinees, took, part, exam, 92810, candidates, total, 842, candidates, absent, three, students, expelled, jashore, education, board, 131579, examinees, took, part, exam, 133379, candidates, total, 1800, students, absent, one, expelled, copying, besides, bangladesh, madrasah, education, board, 252289, examinees, took, part, exam, 261912, students, total, 9623, examinees, absent, 10, expelled, bangladesh, technical, education, board, 128559, examinees, appeared, exam, 131236, candidates, total, 2567, candidates, absent, two, students, expelled","secondari school certif equival exam begin across countri thursdai amid tight secur measur total 26928 examine absent first dai ssc equival exam 22 other expel charg adopt unfair mean inform revel press releas sign board intermedi secondari educ chairman intereduc board examin control committe presid professor dr khandak ehasanul kabir bangla first paper exam hold todai peac atmospher across countri year 1727778 ssc candid across countri 26928 candid absent first dai exam dhaka board total 339458 candid take part ssc exam first dai 342954 candid total 3496 candid absent two examine expel board total 123271 candid take part ssc exam chattogram educ board 124444 examine total 1173 candid absent rajshahi educ board 161057 examine take part exam 162679 candid total 1622 candid absent nativeclick ad barish educ board 77145 examine take part exam 78178 candid two examine expel board sylhet educ board 82114 examine take part first dai exam 82992 total 878 student absent on student expel copi total 166265 examine take part ssc exam dinajpur educ board 167606 candid total 1341 candid absent exam board cumilla educ board total 147056 examine appear exam 149588 candid total 2553 student absent on examine expel mymensingh educ board total 91968 examine take part exam 92810 candid total 842 candid absent three student expel jashor educ board 131579 examine take part exam 133379 candid total 1800 student absent on expel copi besid bangladesh madrasah educ board 252289 examine take part exam 261912 student total 9623 examine absent 10 expel bangladesh technic educ board 128559 examine appear exam 131236 candid total 2567 candid absent two student expel"
866,2,0.363636363636364,"13/05/2025","quamrul, islam, elected, ec, chairman, nrb, bank","quamrul islam elect ec chairman nrb bank","md, quamrul, islam, chowdhury, recently, elected, chairman, executive, committee, nrb, bank, plc, mr, chowdhury, highly, respected, accomplished, banker, four, decades, experience, banking, financial, services, sector, bangladesh, served, managing, director, ceo, mercantile, bank, plc, february, 2019, november, 2024, led, bank, significant, operational, strategic, milestones, prior, becoming, ceo, held, various, key, leadership, positions, bank, including, additional, managing, director, deputy, managing, director, zonal, head, chattogram, region, head, main, branch, dhaka, mr, chowdhury, began, banking, career, 1984, probationary, officer, national, bank, limited, later, served, savp, head, jubilee, road, branch, national, credit, commerce, bank, limited, 1994, 2001, 2001, joined, mercantile, bank, plc, played, pivotal, role, expansion, bank, regional, operational, footprint, mr, chowdhury’s, expertise, encompasses, corporate, banking, sme, finance, international, trade, treasury, liquidity, management, credit, risk, management, regulatory, compliance, leadership, instrumental, successful, implementation, temenos, t24, core, banking, system, mercantile, bank, maintaining, bank, strong, asset, quality, governmenternance, standards, holds, bachelor, commerce, master, commerce, marketing, university, dhaka, throughout, career, mr, chowdhury, actively, participated, numerous, seminars, workshops, executive, leadership, development, programs, home, abroad, attended, key, international, programs, united, statesa, uk, japan, uae, oman, india, hong, kong, malaysia, covering, topics, banking, operations, risk, management, total, quality, management, leadership, development","md quamrul islam chowdhuri recent elect chairman execut committe nrb bank plc mr chowdhuri highli respect accomplish banker four decad experi bank financi servic sector bangladesh serv manag director ceo mercantil bank plc februari 2019 novemb 2024 lead bank signific oper strateg mileston prior becom ceo hold variou kei leadership posit bank includ addit manag director deputi manag director zonal head chattogram region head main branch dhaka mr chowdhuri begin bank career 1984 probationari offic nation bank limit late serv savp head jubile road branch nation credit commerc bank limit 1994 2001 2001 join mercantil bank plc plai pivot role expans bank region oper footprint mr chowdhury’ expertis encompass corpor bank sme financ intern trade treasuri liquid manag credit risk manag regulatori complianc leadership instrument success implement temeno t24 core bank system mercantil bank maintain bank strong asset qualiti governmentern standard hold bachelor commerc master commerc market univers dhaka throughout career mr chowdhuri activ particip numer seminar workshop execut leadership develop program home abroad attend kei intern program unit statesa uk japan uae oman india hong kong malaysia cover topic bank oper risk manag total qualiti manag leadership develop"
